{
  "version": "0.0.0",
  "notes": "Schema example only; this is not a release.",
  "pub_date": "2026-07-21T00:00:00Z",
  "platforms": {
    "darwin-aarch64-app": {
      "url": "https://github.com/kysion/kyclash/releases/download/v0.0.0/KyClash_0.0.0_aarch64.app.tar.gz",
      "signature": "dW50cnVzdGVkIGNvbW1lbnQ6IHNhbXBsZSBvbmx5LCBub3QgYSB2YWxpZCBzaWduYXR1cmUKQUFBQUFBQUFBQUFBQUFBQUFBQUFBQUFBQUFBQUFBQUFBQUFBQUFBQUFBQUFBQUFBQUFBQUFBQUFBQUFBQUFBQUFBQUFBQUFBQUFBQUFBQUFBQUFBQUE9PQp0cnVzdGVkIGNvbW1lbnQ6IHNhbXBsZSBvbmx5CkFBQUFBQUFBQUFBQUFBQUFBQUFBQUFBQUFBQUFBQUFBQUFBQUFBQUFBQUFBQUFBQUFBQUFBQUFBQUFBQUFBQUFBQUFBQUFBQUFBQUFBQUFBQUFBQUFBPT0K",
      "sha256": "0000000000000000000000000000000000000000000000000000000000000000",
      "size": 1
    }
  },
  "kyclash": {
    "schema_version": 1,
    "source_commit": "0000000000000000000000000000000000000000",
    "rollback_version": "0.0.0",
    "channel": "internal",
    "sample": true
  }
}
